{
  "schema_version": 1,
  "operation_id": "54860dff-6f29-4da8-9d10-663cde4e4142",
  "operation": "reserve_reassessment_session",
  "pilot_id": "primary-legacy-v1",
  "session_id": "c11d4269-f116-4748-839c-959f0557e33b",
  "work_ids": [
    "gattaca-1997",
    "grand-budapest-hotel-2014",
    "source-code-2011",
    "project-hail-mary",
    "interstellar-2014"
  ],
  "expected_ledger_digest": "sha256:a401526355a629faf2d0559f9ad4346449dd86d97e649a4d13489f3d3f471b2f"
}
