{
  "schema_version": 1,
  "operation_id": "f2d3d229-f80a-43c5-9407-cc517ab4d1f4",
  "operation": "reserve_reassessment_session",
  "pilot_id": "primary-legacy-v1",
  "session_id": "d48ae6f5-ad68-44d3-994e-68fb3eb5ee60",
  "work_ids": [
    "gattaca-1997",
    "grand-budapest-hotel-2014",
    "source-code-2011",
    "project-hail-mary",
    "interstellar-2014"
  ],
  "expected_ledger_digest": "sha256:a401526355a629faf2d0559f9ad4346449dd86d97e649a4d13489f3d3f471b2f"
}
